<?xml version="1.0" encoding="UTF-8"?>
    <!--XML-Beispieldatei von XMLSpy generiert v2008 rel. 2 sp2 (http://www.altova.com)-->
<FormConfiguration xsi:schemaLocation="http://www.deegree.org/igeoportal schema/formConfiguration.xsd"
    xmlns="http://www.deegree.org/igeoportal" xmlns:xsi="http://www.w3.org/2001/XMLSchema-instance">
    
    <layoutType>tab</layoutType>
    
    <FormGroup id="ContactFormGroup">
        <label>Kontakt</label>
        <title>Kontaktdaten</title>
        <InputFormElement id="KtextName">
            <label>Name (Person):</label>
            <inputType>text</inputType>
        </InputFormElement>
        <InputFormElement id="KtextOrga">
            <label>Organisation:</label>
            <inputType>text</inputType>
        </InputFormElement>
        <SelectFormElement id="KselectRole">
            <label>Rolle/Funktion:</label>
            <selectType>one</selectType>
            <referenceToCodeList>roleCode</referenceToCodeList>
        </SelectFormElement>
        <FormGroup id="KSubFormGRoup">
            <title> Adresse:</title>
            <InputFormElement id="KStextStreet">
                <label>Strasse/Hausnummer:</label>
                <inputType>text</inputType>
            </InputFormElement>
            <InputFormElement id="KStextCity">
                <label>Stadt:</label>
                <inputType>text</inputType>
            </InputFormElement>
            <InputFormElement id="KStextPLZ">
                <label>Postleitzahl:</label>
                <inputType>int</inputType>
                <Validation>
                    <minValue>10000</minValue>
                    <maxValue>99999</maxValue>
                </Validation>
            </InputFormElement>
            <InputFormElement id="KStextCountry">
                <label>Land:</label>
                <inputType>text</inputType>
            </InputFormElement>
        </FormGroup>
        <InputFormElement id="KtextPhone">
            <label>Telefonnummer:</label>
            <inputType>text</inputType>
        </InputFormElement>
        <InputFormElement id="KtextFax">
            <label>Fax-Nummer:</label>
            <inputType>text</inputType>
        </InputFormElement>
        <InputFormElement id="KtextEmail">
            <label>EMail-Adresse:</label>
            <inputType>text</inputType>
        </InputFormElement>
    </FormGroup>
</FormConfiguration>
