<?xml version="1.0" encoding="UTF-8"?>
    <!--XML-Beispieldatei von XMLSpy generiert v2008 rel. 2 sp2 (http://www.altova.com)-->
<FormConfiguration xsi:schemaLocation="http://www.deegree.org/igeoportal schema/formConfiguration.xsd"
    xmlns="http://www.deegree.org/igeoportal" xmlns:xsi="http://www.w3.org/2001/XMLSchema-instance">
    <layoutType>tab</layoutType>

    <FormGroup id="TestFormGroup">
        <label>Test</label>
        <title>Teste das Problem</title>
        <InputFormElement id="text5">
            <label>Problem:</label>
            <help>Die Hilfe für das Element text5 zum testen des Problems</help>
            <inputType>text</inputType>
        </InputFormElement>
        <SelectFormElement id="selectOneH" visible="true">
            <label>Hierarchieebene:</label>
            <selectType>many</selectType>
            <referenceToCodeList>countries</referenceToCodeList>
                <selectedValue>spain, greek</selectedValue>
        </SelectFormElement>
    </FormGroup>

    <FormGroup id="AllgFormGroup">
        <label>Angaben 2</label>
        <title>Allgemeine Angaben zum Metadatensatz</title>
        <SelectFormElement id="selectOne11" visible="true">
            <label>Hierarchieebene:</label>
            <selectType>one</selectType>
            <referenceToCodeList>hierarchylevel</referenceToCodeList>
            <selectedValue>service</selectedValue>
        </SelectFormElement>
        <InputFormElement id="text11">
            <label>Titel:</label>
            <inputType>text</inputType>
        </InputFormElement>
        <FormGroup id="FormGroup21">
            <title>Für die Metadaten zuständige Stelle/Person:</title>
            <InputFormElement id="text21">
                <label>Name (Person):</label>
                <inputType>text</inputType>
            </InputFormElement>
            <InputFormElement id="text31">
                <label>Organisation:</label>
                <inputType>text</inputType>
            </InputFormElement>
            <InputFormElement id="text14">
                <label>PLZ:</label>
                <inputType>int</inputType>
                <defaultValue>12345</defaultValue>
                <Validation>
                    <minValue>10000</minValue>
                    <maxValue>99999</maxValue>
                </Validation>
            </InputFormElement>
            <SelectFormElement id="selectOne12">
                <selectType>one</selectType>
                <referenceToCodeList>countries</referenceToCodeList>
            </SelectFormElement>
        </FormGroup>
    </FormGroup>

    <CodeList id="hierarchylevel">
        <Code>
            <value>dataset</value>
            <label>Datensatz</label>
        </Code>
        <Code>
            <value>service</value>
            <label>Service</label>
        </Code>
    </CodeList>
    <CodeList id="countries">
        <Code>
            <value>italy</value>
            <label>Italien</label>
        </Code>
        <Code>
            <value>spain</value>
            <label>Spanien</label>
        </Code>
        <Code>
            <value>greek</value>
            <label>Griechenland</label>
        </Code>
    </CodeList>
</FormConfiguration>
