<?xml version="1.0" encoding="UTF-8"?>
    <!--XML-Beispieldatei von XMLSpy generiert v2008 rel. 2 sp2 (http://www.altova.com)-->
<FormConfiguration xsi:schemaLocation="http://www.deegree.org/igeoportal schema/formConfiguration.xsd"
    xmlns="http://www.deegree.org/igeoportal" xmlns:xsi="http://www.w3.org/2001/XMLSchema-instance">
    <layoutType>tab</layoutType>

    <FormGroup id="FormGroup3">
        <label>Test</label>
        <title>Teste das Problem</title>
        <InputFormElement id="text5">
            <label>Problem:</label>
            <help>Die Hilfe für das Element text5 zum testen des Problems</help>
            <inputType>text</inputType>
        </InputFormElement>
        <InputFormElement id="text5">
            <label>Problem:</label>
            <help>Die Hilfe für das Element text5 zum testen des Problems</help>
            <inputType>text</inputType>
        </InputFormElement>
        <ReferencedFormElement id="ref" isIdentifier="true">
            <label>Id:</label>
            <help>Hiermit können sie eine eindeutige Id für den Datensatz generieren</help>
            <bean-name>generateIdBean</bean-name>
        </ReferencedFormElement>
    </FormGroup>

    <FormGroup id="FormGroup">
        <label>Allgemeine Angaben</label>
        <title>Allgemeine Angaben zum Metadatensatz</title>
        <SelectFormElement id="selectOne1" visible="true" required="true">
            <label>Hierarchieebene:</label>
            <selectType>one</selectType>
            <referenceToCodeList>hierarchylevel</referenceToCodeList>
        </SelectFormElement>
        <InputFormElement id="text1">
            <label>Titel:</label>
            <inputType>text</inputType>
        </InputFormElement>
        <FormGroup id="FormGroup11">
            <title>Für die Metadaten zuständige Stelle/Person:</title>
            <InputFormElement id="text2">
                <label>Name (Person):</label>
                <inputType>text</inputType>
            </InputFormElement>
            <InputFormElement id="text3">
                <label>Organisation:</label>
                <inputType>text</inputType>
            </InputFormElement>
            <InputFormElement id="text4">
                <label>PLZ:</label>
                <inputType>int</inputType>
                <defaultValue>12345</defaultValue>
                <Validation>
                    <minValue>10000</minValue>
                    <maxValue>99999</maxValue>
                </Validation>
            </InputFormElement>
            <SelectFormElement id="selectOne2">
                <selectType>one</selectType>
            </SelectFormElement>
        </FormGroup>
    </FormGroup>

    <CodeList id="testCodeList1">
        <Code id="1">
            <value>dataset</value>
            <label>Dataset</label>
        </Code>
        <Code id="2">
            <value>service</value>
            <label>Service</label>
        </Code>
    </CodeList>
    <CodeList id="testCodeList2">
        <Code id="1">
            <value>nummer1</value>
            <label>Nummer 1</label>
        </Code>
        <Code id="2">
            <value>nummer2</value>
            <label>Nummer 2</label>
        </Code>
        <Code id="3">
            <value>nummer3</value>
            <label>Nummer 3</label>
        </Code>
    </CodeList>

</FormConfiguration>
