<?xml version="1.0" encoding="UTF-8"?>
    <!--XML-Beispieldatei von XMLSpy generiert v2008 rel. 2 sp2 (http://www.altova.com)-->
<FormConfiguration xsi:schemaLocation="http://www.deegree.org/igeoportal schema/formConfiguration.xsd"
    xmlns="http://www.deegree.org/igeoportal" xmlns:xsi="http://www.w3.org/2001/XMLSchema-instance">
    <layoutType>tab</layoutType>

    <DatasetConfiguration>
        <identifier>AllgFormGroup/ref</identifier>
        <title>InhFormGroup/titel</title>
        <description>InhFormGroup/description</description>
        <Mapping>
            <mappingURL>isoMapping.xml</mappingURL>
        </Mapping>
    </DatasetConfiguration>

    <FormGroup id="AllgFormGroup">
        <label>AllgFormGroup_l</label>
        <title>AllgFormGroup_t</title>
        <ReferencedFormElement id="ref" required="true">
            <label>AllgFormGroup_ref_l</label>
            <help>AllgFormGroup_ref_h</help>
            <bean-name>generateIdBean</bean-name>
        </ReferencedFormElement>
        <SelectFormElement id="hierarchylevel" visible="true">
            <label>AllgFormGroup_hier_l</label>
            <selectType>one</selectType>
            <referenceToCodeList>hierarchylevel</referenceToCodeList>
        </SelectFormElement>

        <!-- TODO: Elternobjekt -->
        <!--
            <SelectFormElement id="selectOneK" visible="true"> <label>Eltern-Objekt:</label>
            <selectType>one</selectType> <referenceToGroup></referenceToGroup> </SelectFormElement>
        -->

        <SelectFormElement id="contactMD" visible="true">
            <label>AllgFormGroup_contact_l</label>
            <selectType>one</selectType>
            <referenceToGroup>ContactFormGroup</referenceToGroup>
            <referenceText>Name: ${KtextName}</referenceText>
        </SelectFormElement>
    </FormGroup>

    <FormGroup id="InhFormGroup">
        <label>InhFormGroup_l</label>
        <title>InhFormGroup_t</title>
        <InputFormElement id="title" required="true">
            <label>InhFormGroup_title_l</label>
            <help>InhFormGroup_title_h</help>
            <inputType>text</inputType>
        </InputFormElement>
        <InputFormElement id="description" required="true">
            <label>InhFormGroup_desc_l</label>
            <help>InhFormGroup_desc_h</help>
            <inputType>textarea</inputType>
        </InputFormElement>
        <SelectFormElement id="theme" visible="true">
            <label>InhFormGroup_theme_l</label>
            <help>InhFormGroup_theme_h</help>
            <selectType>one</selectType>
            <referenceToCodeList>topicCategory</referenceToCodeList>
        </SelectFormElement>
        <SelectFormElement id="keywords" visible="true">
            <label>InhFormGroup_keywords_l</label>
            <selectType>many</selectType>
            <referenceToCodeList>keyword</referenceToCodeList>
        </SelectFormElement>
        <InputFormElement id="origin">
            <label>InhFormGroup_origin_l</label>
            <inputType>textarea</inputType>
        </InputFormElement>
        <!--
            <InputFormElement id="lenght"> <label>InhFormGroup_lengh_l</label> <inputType>text</inputType> <Validation>
            <length>10</length> </Validation> </InputFormElement> <InputFormElement id="date"> <label>Datum:</label>
            <inputType>timestamp</inputType> </InputFormElement> <InputFormElement id="range"> <label>Range:</label>
            <inputType>int</inputType> <Validation> <minValue>10</minValue> <maxValue>99</maxValue> </Validation>
            </InputFormElement> <SelectFormElement id="contactData" visible="true"> <label>Zuständige Stelle/Person
            (Daten):</label> <selectType>one</selectType> <referenceToGroup>ContactFormGroup</referenceToGroup>
            </SelectFormElement> </FormGroup>
        -->
        <!--
            <InputFormElement id="ganzzahl1"> <label>int größer 23:</label> <inputType>int</inputType> <Validation>
            <minValue>23</minValue> </Validation> </InputFormElement> <InputFormElement id="ganzzahl2"> <label> int
            größer 23, kleiner 27:</label> <inputType>int</inputType> <Validation> <minValue>23</minValue>
            <maxValue>27</maxValue> </Validation> </InputFormElement> <InputFormElement id="ganzzahl3"> <label> int
            kleiner 27:</label> <inputType>int</inputType> <Validation> <maxValue>27</maxValue> </Validation>
            </InputFormElement> <InputFormElement id="fließzahl1"> <label>double größer 23:</label>
            <inputType>double</inputType> <Validation> <minValue>23</minValue> </Validation> </InputFormElement>
            <InputFormElement id="fließzahl2"> <label>double größer 23, kleiner 27:</label>
            <inputType>double</inputType> <Validation> <minValue>23</minValue> <maxValue>27</maxValue> </Validation>
            </InputFormElement> <InputFormElement id="fließzahl3"> <label>double kleiner 27:</label>
            <inputType>double</inputType> <Validation> <maxValue>27</maxValue> </Validation> </InputFormElement>
            <InputFormElement id="text"> <label>text max 2:</label> <inputType>text</inputType> <Validation>
            <length>2</length> </Validation> </InputFormElement>
        -->
    </FormGroup>

    <FormGroup id="SpatialFormGroup">
        <label>SpatialFormGroup_l</label>
        <title>SpatialFormGroup_t</title>
        <SelectFormElement id="country">
            <label>SpatialFormGroup_country_t</label>
            <selectType>one</selectType>
            <referenceToCodeList>countries</referenceToCodeList>
        </SelectFormElement>
    </FormGroup>

    <FormGroup id="TimeFormGroup">
        <label>TimeFormGroup_l</label>
        <title>TimeFormGroup_t</title>
        <InputFormElement id="creation">
            <label>TimeFormGroup_creation_l</label>
            <inputType>timestamp</inputType>
        </InputFormElement>
        <InputFormElement id="publication">
            <label>TimeFormGroup_pub_l</label>
            <inputType>timestamp</inputType>
        </InputFormElement>
        <InputFormElement id="modified">
            <label>TimeFormGroup_mod_l</label>
            <inputType>timestamp</inputType>
        </InputFormElement>
        <FormGroup id="TimePeriodFormGroup">
            <title>TimeFormGroup_per_t</title>
            <InputFormElement id="begin">
                <label>TimeFormGroup_per_beg_l</label>
                <inputType>timestamp</inputType>
            </InputFormElement>
            <InputFormElement id="end">
                <label>TimeFormGroup_per_end_l</label>
                <inputType>timestamp</inputType>
            </InputFormElement>
        </FormGroup>
    </FormGroup>


    <FormGroup id="FormatFormGroup" occurence="unbounded">
        <label>FormatFormGroup_l</label>
        <title>FormatFormGroup_t</title>
        <InputFormElement id="Formatname">
            <label>FormatFormGroup_name_l</label>
            <help>FormatFormGroup_name_h</help>
            <inputType>text</inputType>
        </InputFormElement>
        <InputFormElement id="FormatVersion">
            <label>FormatFormGroup_vers_l</label>
            <help>FormatFormGroup_vers_h</help>
            <inputType>text</inputType>
        </InputFormElement>
    </FormGroup>

</FormConfiguration>
