<?xml version="1.0" encoding="UTF-8"?>
    <!--XML-Beispieldatei von XMLSpy generiert v2008 rel. 2 sp2 (http://www.altova.com)-->
<FormConfiguration xsi:schemaLocation="http://www.deegree.org/igeoportal schema/formConfiguration.xsd"
    xmlns="http://www.deegree.org/igeoportal" xmlns:xsi="http://www.w3.org/2001/XMLSchema-instance">
    <layoutType>tab</layoutType>
    
    <DatasetConfiguration>
        <identifier>AllgFormGroup/ref</identifier>
        <title>AllgFormGroup/InhFormGroup/titel</title>
        <description>AllgFormGroup/InhFormGroup/description</description>
        <Mapping>
            <mappingURL>isoMapping.xml</mappingURL>
        </Mapping>
    </DatasetConfiguration>
    
    <FormGroup id="AllgFormGroup">
        <label>Allgemein</label>
        <title>Allgemeine Angaben zum Metadatensatz</title>
        <ReferencedFormElement id="ref" required="true">
            <label>Id:</label>
            <help>Hiermit können sie eine eindeutige Id für den Datensatz generieren</help>
            <bean-name>generateIdBean</bean-name>
        </ReferencedFormElement>
        <SelectFormElement id="contactMD" visible="true">
            <label>Zuständige Stelle/Person (Metadatensatz):</label>
            <help>Hiermit können sie eine eindeutige Id für den Datensatz generieren</help>
            <selectType>one</selectType>
            <referenceToGroup>ContactFormGroup</referenceToGroup>
            <referenceText>Name: ${KtextName}</referenceText>
        </SelectFormElement>

        <FormGroup id="InhFormGroup">
            <label>Inhaltlich</label>
            <title>Inhaltliche Angaben zu den beschriebenen Daten</title>
            <InputFormElement id="titel" required="true">
                <label>Titel/Name:</label>
                <help>Bezeichnung, unter der die Ressource bekannt ist</help>
                <inputType>text</inputType>
            </InputFormElement>
            <InputFormElement id="description" required="true">
                <label>Beschreibung:</label>
                <help>kurze, beschreibende Zusammenfassung des Inhalts der Ressource</help>
                <inputType>textarea</inputType>
            </InputFormElement>
            <SelectFormElement id="themeI" visible="true">
                <label>Thema:</label>
                <help>thematische Einordnung des Datenbestand</help>
                <selectType>one</selectType>
                <referenceToCodeList>theme</referenceToCodeList>
            </SelectFormElement>
            <SelectFormElement id="keywords" visible="true">
                <label>Schlagworte:</label>
                <selectType>many</selectType>
                <referenceToCodeList>keyword</referenceToCodeList>
            </SelectFormElement>
            <InputFormElement id="origin">
                <label>Herkunft des Datenbestandes:</label>
                <inputType>textarea</inputType>
            </InputFormElement>
            <SelectFormElement id="contactData" visible="true">
                <label>Zuständige Stelle/Person (Daten):</label>
                <selectType>one</selectType>
                <referenceToGroup>ContactFormGroup</referenceToGroup>
            </SelectFormElement>
        </FormGroup>
    </FormGroup>

    <FormGroup id="SpatialFormGroup">
        <label>Räumlich</label>
        <title>Räumliche Angaben zum Metadatensatz</title>
        <SelectFormElement id="country">
            <label>Geltungsbereich:</label>
            <selectType>one</selectType>
            <referenceToCodeList>countries</referenceToCodeList>
        </SelectFormElement>
    </FormGroup>

</FormConfiguration>
