<?xml version="1.0" encoding="UTF-8"?>
    <!--XML-Beispieldatei von XMLSpy generiert v2008 rel. 2 sp2 (http://www.altova.com)-->
<FormConfiguration xsi:schemaLocation="http://www.deegree.org/igeoportal schema/formConfiguration.xsd"
    xmlns="http://www.deegree.org/igeoportal" xmlns:xsi="http://www.w3.org/2001/XMLSchema-instance">
    <layoutType>tab</layoutType>
    
    <identifier>FormGroup3/ref</identifier>
    <title>FormGroup/text1</title>
    <description>FormGroup/FormGroup11/text2</description>
    
    <Mapping>
        <mappingURL>../mapping/mappingTest.xml</mappingURL>
    </Mapping>

    <FormGroup id="FormGroup3">
        <label>Test</label>
        <title>Teste das Problem</title>
        <InputFormElement id="text5">
            <label>Problem:</label>
            <help>Die Hilfe für das Element text5 zum testen des Problems</help>
            <inputType>text</inputType>
        </InputFormElement>
        <ReferencedFormElement id="ref">
            <label>Id:</label>
            <help>Hiermit können sie eine eindeutige Id für den Datensatz generieren</help>
            <bean-name>generateIdBean</bean-name>
        </ReferencedFormElement>
    </FormGroup>

    <FormGroup id="FormGroup" occurence="unbounded">
        <label>Allgemeine Angaben</label>
        <title>Allgemeine Angaben zum Metadatensatz</title>
        <SelectFormElement id="selectOne1" visible="true" required="true">
            <label>Hierarchieebene:</label>
            <selectType>one</selectType>
            <referenceToCodeList>hierarchylevel</referenceToCodeList>
        </SelectFormElement>
        <InputFormElement id="text1">
            <label>Titel:</label>
            <inputType>text</inputType>
            <Validation>
                <length>5</length>
            </Validation>
        </InputFormElement>
        <FormGroup id="FormGroup11">
            <title>Für die Metadaten zuständige Stelle/Person:</title>
            <InputFormElement id="text2">
                <label>Name (Person):</label>
                <inputType>text</inputType>
            </InputFormElement>
            <InputFormElement id="text3">
                <label>Organisation:</label>
                <inputType>text</inputType>
            </InputFormElement>
            <InputFormElement id="text4">
                <label>PLZ:</label>
                <inputType>int</inputType>
                <defaultValue>12345</defaultValue>
                <Validation>
                    <minValue>10000</minValue>
                    <maxValue>99999</maxValue>
                </Validation>
            </InputFormElement>
            <SelectFormElement id="selectOne2">
                <selectType>many</selectType>
            </SelectFormElement>
        </FormGroup>
    </FormGroup>
    
    
    <FormGroup id="SimpleUnboundedFormGroup" occurence="unbounded">
        <label>NFach</label>
        <title>nFacheGruppe</title>
        <InputFormElement id="in1">
            <label>Problem1:</label>
            <inputType>text</inputType>
        </InputFormElement>
        <InputFormElement id="in2">
            <label>Problem2:</label>
            <inputType>text</inputType>
        </InputFormElement>
    </FormGroup>

</FormConfiguration>
