<?xml version="1.0" encoding="UTF-8"?>
    <!--XML-Beispieldatei von XMLSpy generiert v2008 rel. 2 sp2 (http://www.altova.com)-->
<FormConfiguration xsi:schemaLocation="http://www.deegree.org/igeoportal schema/formConfiguration.xsd"
    xmlns="http://www.deegree.org/igeoportal" xmlns:xsi="http://www.w3.org/2001/XMLSchema-instance">

    <layoutType>tab</layoutType>

    <FormGroup id="ContactFormGroup">
        <label>ContactFormGroup_l</label>
        <title>ContactFormGroup_t</title>
        <InputFormElement id="KName">
            <label>ContactFormGroup_KName_l</label>
            <inputType>text</inputType>
        </InputFormElement>
        <InputFormElement id="KOrga">
            <label>ContactFormGroup_KOrga_l</label>
            <inputType>text</inputType>
        </InputFormElement>
        <SelectFormElement id="KRole">
            <label>ContactFormGroup_KRole_l</label>
            <selectType>one</selectType>
            <referenceToCodeList>roleCode</referenceToCodeList>
        </SelectFormElement>
        <FormGroup id="KAdd">
            <title>ContactFormGroup_KAdd_t</title>
            <InputFormElement id="KSStreet">
                <label>ContactFormGroup_KSStreet_l</label>
                <inputType>text</inputType>
            </InputFormElement>
            <InputFormElement id="KSCity">
                <label>ContactFormGroup_KSCity_l</label>
                <inputType>text</inputType>
            </InputFormElement>
            <InputFormElement id="KSPLZ">
                <label>ContactFormGroup_KSPLZ_l</label>
                <inputType>int</inputType>
                <Validation>
                    <minValue>10000</minValue>
                    <maxValue>99999</maxValue>
                </Validation>
            </InputFormElement>
            <InputFormElement id="KSCountry">
                <label>ContactFormGroup_KSCountry_l</label>
                <inputType>text</inputType>
            </InputFormElement>
        </FormGroup>
        <InputFormElement id="KPhone">
            <label>ContactFormGroup_KPhone_l</label>
            <inputType>text</inputType>
        </InputFormElement>
        <InputFormElement id="KFax">
            <label>ContactFormGroup_KFax_l</label>
            <inputType>text</inputType>
        </InputFormElement>
        <InputFormElement id="KEmail">
            <label>ContactFormGroup_KEmail_l</label>
            <inputType>text</inputType>
        </InputFormElement>
    </FormGroup>
</FormConfiguration>
